{
  "$schema": "https://json-schema.org/draft/2020-12/schema",
  "$id": "https://npdev.local/schema/npdev-config-v1.schema.json",
  "title": "NPDev Config v1",
  "type": "object",
  "$comment": "storage/FULL_SUPPORT_PLAN.md W6.1. NOTHING validated this file until 2026-08-08, and the moment something did, 27 corpus configs failed with 93 errors -- including the T1-frozen, shipped npdev-canary. The schema, not the corpus, was mostly wrong: it demanded a `database` block 15 working apps have never had, demanded Postgres connection fields from engines that do not listen on a port, and forbade a `console` section four official apps use and a gate already reads. Widening a schema nobody checks is widening a comment, so the contract was corrected FIRST and the enforcement (check-config-schema.py) added second.",
  "additionalProperties": false,
  "required": [
    "configVersion",
    "scenario",
    "generator",
    "bootstrap",
    "artifact",
    "finalExec",
    "runtime"
  ],
  "properties": {
    "$schema": {
      "type": "string"
    },
    "configVersion": {
      "type": "string",
      "const": "1.0"
    },
    "scenario": {
      "type": "object",
      "additionalProperties": false,
      "required": ["name", "outputRoot"],
      "properties": {
        "name": {
          "type": "string",
          "minLength": 1
        },
        "description": {
          "type": "string"
        },
        "outputRoot": {
          "type": "string",
          "minLength": 1
        }
      }
    },
    "generator": {
      "type": "object",
      "additionalProperties": false,
      "required": [
        "failIfModelMissing",
        "failIfConfigMissing",
        "cleanOutputBeforeGenerate",
        "emitPluginAssets",
        "emitRuntimeAssets",
        "emitUiAssets"
      ],
      "properties": {
        "failIfModelMissing": { "type": "boolean" },
        "failIfConfigMissing": { "type": "boolean" },
        "cleanOutputBeforeGenerate": { "type": "boolean" },
        "emitPluginAssets": { "type": "boolean" },
        "emitRuntimeAssets": { "type": "boolean" },
        "emitUiAssets": { "type": "boolean" }
      }
    },
    "bootstrap": {
      "type": "object",
      "additionalProperties": false,
      "required": ["root", "mergeStrategy"],
      "properties": {
        "root": {
          "type": "string",
          "minLength": 1
        },
        "mergeStrategy": {
          "type": "string",
          "enum": ["clean-copy", "robocopy-merge"]
        }
      }
    },
    "artifact": {
      "type": "object",
      "additionalProperties": false,
      "required": ["root", "generatedFolderName", "libsFolderName", "metaFolderName"],
      "properties": {
        "root": {
          "type": "string",
          "minLength": 1
        },
        "generatedFolderName": {
          "type": "string",
          "minLength": 1
        },
        "libsFolderName": {
          "type": "string",
          "minLength": 1
        },
        "metaFolderName": {
          "type": "string",
          "minLength": 1
        }
      }
    },
    "finalExec": {
      "type": "object",
      "additionalProperties": false,
      "required": ["root", "deleteBeforeMount"],
      "properties": {
        "root": {
          "type": "string",
          "minLength": 1
        },
        "deleteBeforeMount": {
          "type": "boolean"
        }
      }
    },
    "database": {
      "type": "object",
      "description": "How the SCENARIO provisions a database for this app. Optional: an app whose engine needs no provisioning (h2-local, in-memory) is complete without it, and 15 corpus apps have always been -- `database` was in `required` until 2026-08-08 only because nothing ever checked. The app's own persistence contract is db.definition.json; this block is the scenario harness's side of it.",
      "additionalProperties": false,
      "required": [
        "provider",
        "database",
        "resetMode"
      ],
      "allOf": [
        {
          "$comment": "storage/FULL_SUPPORT_PLAN.md W6.1: the connection fields are required for the engines that LISTEN, and meaningless for the ones that do not. Demanding host/port/username/password from h2-local is what made the shipped canary invalid against its own schema; making them optional for everyone would be the opposite error -- a postgres/mysql/sqlserver scenario with no host is a configuration that cannot work, and it should fail here rather than at connect time.",
          "if": {
            "properties": {
              "provider": {
                "enum": ["docker-postgres", "docker-mysql", "docker-sqlserver", "postgres", "mysql", "sqlserver", "h2-server"]
              }
            },
            "required": ["provider"]
          },
          "then": {
            "required": ["host", "port", "username", "password"]
          }
        }
      ],
      "properties": {
        "provider": {
          "type": "string",
          "description": "The engine this scenario provisions. Kept in step with DatabaseEngine (NPDevGenerator/.../dbconfig/DatabaseEngine.java) -- an engine selectable there but absent here would be a configuration the platform supports and its own schema rejects, which is what `h2-local` was for as long as this enum said Postgres or nothing.",
          "enum": [
            "docker-postgres",
            "docker-mysql",
            "docker-sqlserver",
            "postgres",
            "mysql",
            "sqlserver",
            "h2-local",
            "h2-server",
            "in-memory"
          ]
        },
        "host": {
          "type": "string",
          "minLength": 1
        },
        "port": {
          "type": "integer",
          "minimum": 1,
          "maximum": 65535
        },
        "database": {
          "type": "string",
          "minLength": 1
        },
        "username": {
          "type": "string",
          "minLength": 1
        },
        "password": {
          "type": "string"
        },
        "adminDatabase": {
          "type": "string",
          "minLength": 1
        },
        "resetMode": {
          "type": "string",
          "enum": ["reset", "preserve"]
        },
        "containerName": {
          "type": "string"
        }
      }
    },
    "runtime": {
      "type": "object",
      "additionalProperties": false,
      "required": ["serverPort", "javaArgs"],
      "properties": {
        "binder": {
          "type": "string",
          "description": "P0.6 (Path A realignment): the runtime binder that mounts the generated projection. Optional -- absent means 'spring', the only implemented value today. Exists so springProfile/gradleTask can be scoped to the binder that needs them instead of required unconditionally, which is what made the config contract itself claim Spring was the identity rather than a binder.",
          "enum": ["spring"]
        },
        "springProfile": {
          "type": "string",
          "minLength": 1
        },
        "serverPort": {
          "type": "integer",
          "minimum": 1,
          "maximum": 65535
        },
        "javaArgs": {
          "type": "array",
          "items": { "type": "string" }
        },
        "gradleTask": {
          "type": "string",
          "enum": ["bootRun"]
        }
      },
      "if": {
        "properties": { "binder": { "const": "spring" } }
      },
      "then": {
        "required": ["springProfile", "gradleTask"]
      }
    },
    "build": {
      "type": "object",
      "description": "deps-and-java/PLAN.md D1/D2: build facts, not domain truth -- kept out of model.json on purpose (a new model.json array triggers the four-place threading hazard that produced REG-108).",
      "additionalProperties": false,
      "properties": {
        "javaVersion": {
          "type": "integer",
          "description": "The generated app's own Gradle toolchain language version. Platform modules (dsl/kernel/generator/adapters/runtimehost source) stay pinned at 17 regardless of this value -- only the generated app's own compile/run toolchain is variable. ROUND2_PLAN.md R1c: no upper enum on purpose -- any integer >=17 is accepted at this layer; the real ceiling (whatever the generated app's own bundled Gradle wrapper/foojay resolver can actually resolve a JDK for) is enforced by Gradle itself at build time, not guessed at here.",
          "minimum": 17,
          "default": 17
        },
        "repositories": {
          "type": "array",
          "description": "deps-and-java/PLAN.md W2.1: extra Maven repositories the app's own build.dependencies[] may need beyond mavenCentral() (always implicitly available).",
          "items": {
            "type": "object",
            "additionalProperties": false,
            "required": ["url"],
            "properties": {
              "name": { "type": "string", "minLength": 1 },
              "url": { "type": "string", "minLength": 1, "pattern": "^https?://" }
            }
          }
        },
        "dependencies": {
          "type": "array",
          "description": "deps-and-java/PLAN.md W2.1/D2 (AppDependenciesEmitter, npdev-dependencies.gradle): app-scoped third-party dependencies. String shorthand = implementation + Maven coordinate.",
          "items": {
            "oneOf": [
              {
                "type": "string",
                "minLength": 1,
                "pattern": "^[^:\\s]+:[^:\\s]+:[^:\\s]+$",
                "description": "Maven coordinate shorthand (groupId:artifactId:version), implementation scope."
              },
              {
                "type": "object",
                "additionalProperties": false,
                "required": ["coordinate"],
                "properties": {
                  "coordinate": { "type": "string", "minLength": 1, "pattern": "^[^:\\s]+:[^:\\s]+:[^:\\s]+$" },
                  "scope": { "type": "string", "enum": ["implementation", "runtimeOnly", "compileOnly", "testImplementation"] }
                }
              },
              {
                "type": "object",
                "additionalProperties": false,
                "required": ["jar"],
                "description": "A local jar, resolved relative to <model.json's own directory>/libs/ at generation time.",
                "properties": {
                  "jar": { "type": "string", "minLength": 1 },
                  "scope": { "type": "string", "enum": ["implementation", "runtimeOnly", "compileOnly", "testImplementation"] }
                }
              },
              {
                "type": "object",
                "additionalProperties": false,
                "required": ["platform"],
                "description": "A Maven BOM, imported via Gradle's platform(...) so it constrains versions without itself becoming a direct dependency.",
                "properties": {
                  "platform": { "type": "string", "minLength": 1, "pattern": "^[^:\\s]+:[^:\\s]+:[^:\\s]+$" }
                }
              }
            ]
          }
        }
      }
    },
    "trialDefaults": {
      "type": "object",
      "additionalProperties": false,
      "properties": {
        "apiKey": {
          "type": "string",
          "minLength": 1,
          "description": "ADVISORY, generation-time only (R7 Stage D). Every generated app's REAL admin key is now chosen at first LAUNCH, per app, at random, and saved to secrets/api-key.env (Ensure-NpdevApiKey) -- this field is never read as a live credential by any launcher. It exists so `resolved-db-plan.json`/documentation have a plausible default to print BEFORE that key exists, and is only accurate as a working credential when `recommendedProfiles` includes `dev` and the app is launched WITHOUT going through Ensure-NpdevApiKey (application-dev.yml's own accepted-risk static default)."
        },
        "recommendedProfiles": {
          "type": "string",
          "minLength": 1
        },
        "runtimeUrl": {
          "type": "string",
          "minLength": 1
        },
        "databaseMode": {
          "type": "string",
          "description": "ADVISORY. Which persistence mode this scenario's notes describe; the app's real engine comes from db.definition.json's database.engine, and no code reads this field. It stays enumerated anyway so a typo is caught (`h2local-file` was one, found the day this schema was first enforced), and it accepts BOTH spellings the corpus uses: the kebab scenario names and DatabaseEngine's own externalName values -- both are canonical somewhere in the platform, and rewriting ten app definitions in a non-repo layer to unify cosmetics would be churn, not correctness.",
          "enum": [
            "step0-h2",
            "docker-postgres",
            "docker-mysql",
            "docker-sqlserver",
            "postgres",
            "mysql",
            "sqlserver",
            "h2-local",
            "h2-server",
            "in-memory",
            "InMemory",
            "H2Local",
            "H2Server",
            "Postgres",
            "MySQL",
            "SqlServer"
          ]
        },
        "pluginDiscoveryMode": {
          "type": "string",
          "enum": ["classpath", "filesystem-folder"]
        },
        "pluginPackageDirectory": {
          "type": "string",
          "minLength": 1
        },
        "notes": {
          "type": "array",
          "items": {
            "type": "string"
          }
        }
      }
    },
    "defaults": {
      "type": "object",
      "description": "Behaviour-setting defaults for the whole app, as settingId -> value (NPDev resolution-pipeline envelope).",
      "additionalProperties": {
        "type": ["boolean", "string", "integer", "number"]
      }
    },
    "overrides": {
      "type": "object",
      "description": "Per-target setting overrides keyed by selector (module:Name | concept:Name | field:Concept.field).",
      "additionalProperties": {
        "type": "object",
        "additionalProperties": {
          "type": ["boolean", "string", "integer", "number"]
        }
      }
    },
    "packs": {
      "type": "object",
      "description": "Third-party packs to compose into this app's model. GeneratorMain.readInstalledPackAliases reads `packs.included` on every run -- and this schema forbade the whole section until 2026-08-08, so a user following the documented pack-install path would have written a config the generator accepts and the contract rejects. Found by enforcing the schema for the first time; no corpus app used it yet, which is exactly why it went unnoticed.",
      "additionalProperties": false,
      "properties": {
        "included": {
          "type": "array",
          "items": { "type": "string", "minLength": 1 }
        }
      }
    },
    "console": {
      "type": "object",
      "description": "The generated app's admin console posture (scripts/appgen/New-AppConsole.ps1). Four official apps have carried this for months and run-app-upgrade-contract-gate.ps1 already branches on whether an app definition declares it -- so it is real, used, and was rejected by this schema purely because nothing had ever validated a config.json. additionalProperties stays open: this is an AppGen-layer section whose shape is owned by the console generator, and pinning a shape here from a single example is how a schema starts refusing valid input again.",
      "additionalProperties": true,
      "properties": {
        "mode": { "type": "string", "minLength": 1 }
      }
    },
    "metadata": {
      "type": "object"
    }
  }
}
