{
  "$schema": "..\\..\\NPDevContract\\schemas\\config.schema.json",
  "configVersion": "1.0",
  "scenario": {
    "name": "restaurant-saas-multitenant",
    "description": "Tenant-modeled SaaS restaurant sample with Pizza House, Sushi Bar, and Vegan Bistro as isolated restaurant customers.",
    "outputRoot": "..\\Output"
  },
  "generator": {
    "failIfModelMissing": true,
    "failIfConfigMissing": true,
    "cleanOutputBeforeGenerate": true,
    "emitPluginAssets": true,
    "emitRuntimeAssets": true,
    "emitUiAssets": true
  },
  "bootstrap": {
    "root": "..\\..\\NPDevRuntimeHost",
    "mergeStrategy": "clean-copy"
  },
  "artifact": {
    "root": "..\\Output\\ArtifactNP",
    "generatedFolderName": "npdev-generated",
    "libsFolderName": "libs",
    "metaFolderName": "npdev-meta"
  },
  "finalExec": {
    "root": "..\\Output\\App",
    "deleteBeforeMount": true
  },
  "database": {
    "provider": "docker-postgres",
    "host": "localhost",
    "port": 5432,
    "database": "restaurant_saas_multitenant",
    "username": "finalexec",
    "password": "finalexec",
    "adminDatabase": "postgres",
    "resetMode": "reset",
    "containerName": "npdev-restaurant-saas-multitenant"
  },
  "runtime": {
    "springProfile": "dev,trial",
    "serverPort": 8093,
    "javaArgs": [],
    "gradleTask": "bootRun"
  },
  "trialDefaults": {
    "apiKey": "api-dev",
    "recommendedProfiles": "dev,trial",
    "runtimeUrl": "http://localhost:8093/",
    "databaseMode": "h2-local",
    "notes": [
      "This sample models tenant ownership explicitly through Tenant plus tenantRef references -- an app-level business concept.",
      "Separately, the platform itself now enforces real authenticated-tenant isolation (tenant_id) on every generated CRUD row, on both the generic CRUD path and flow-driven persistence, and rejects a tenantRef bond pointing at another platform tenant's row.",
      "CRUD population scripts use the generated REST API only; they do not write to the database directly.",
      "Use 'dev,trial' (not 'dev,step0,trial') to boot against the real H2Local database in Input/db.definition.json -- step0 would override it with an ephemeral in-memory store.",
      "demonstrate-platform-tenancy.ps1 walks through the platform admin surfaces: /api/admin/tenants (create/disable/enable), /api/admin/credentials (issue/revoke), and the resulting authenticated-tenant isolation."
    ]
  }
}
