{
  "$schema": "..\\\\..\\\\..\\\\..\\\\NPDevContract\\\\schemas\\\\config.schema.json",
  "configVersion": "1.0",
  "scenario": {
    "name": "p11-handwritten-pages",
    "description": "W0.1 repro-case: a declared companion page (pages.json) backed by web/companion.html + web/theme.css, proving the extension-inventory's handwrittenScreen category is non-zero for a real fixture.",
    "outputRoot": "..\\\\Output"
  },
  "generator": {
    "failIfModelMissing": true,
    "failIfConfigMissing": true,
    "cleanOutputBeforeGenerate": true,
    "emitPluginAssets": false,
    "emitRuntimeAssets": true,
    "emitUiAssets": false
  },
  "bootstrap": {
    "root": "..\\\\..\\\\..\\\\..\\\\NPDevRuntimeHost",
    "mergeStrategy": "clean-copy"
  },
  "artifact": {
    "root": "..\\\\Output\\\\ArtifactNP",
    "generatedFolderName": "npdev-generated",
    "libsFolderName": "libs",
    "metaFolderName": "npdev-meta"
  },
  "finalExec": {
    "root": "..\\\\Output\\\\App",
    "deleteBeforeMount": true
  },
  "database": {
    "provider": "h2-local",
    "database": "p11_handwritten_pages",
    "resetMode": "reset"
  },
  "runtime": {
    "springProfile": "dev,trial",
    "serverPort": 8177,
    "javaArgs": [],
    "gradleTask": "bootRun"
  },
  "trialDefaults": {
    "apiKey": "dev-key",
    "recommendedProfiles": "dev,trial",
    "runtimeUrl": "http://localhost:8177/",
    "databaseMode": "h2-local",
    "notes": [
      "Extension-inventory repro-case for W0.1's handwrittenScreen category. Do not add features."
    ]
  }
}
