{
  "$schema": "..\\..\\..\\NPDevContract\\schemas\\config.schema.json",
  "configVersion": "1.0",
  "scenario": {
    "name": "dom-sales",
    "description": "DOM-2 consumer of the sales pack; not frozen.",
    "outputRoot": "..\\Output"
  },
  "generator": {
    "failIfModelMissing": true,
    "failIfConfigMissing": true,
    "cleanOutputBeforeGenerate": true,
    "emitPluginAssets": true,
    "emitRuntimeAssets": true,
    "emitUiAssets": true
  },
  "bootstrap": { "root": "..\\..\\..\\NPDevRuntimeHost", "mergeStrategy": "clean-copy" },
  "artifact": { "root": "..\\Output\\ArtifactNP", "generatedFolderName": "npdev-generated", "libsFolderName": "libs", "metaFolderName": "npdev-meta" },
  "finalExec": { "root": "..\\Output\\App", "deleteBeforeMount": true },
  "database": { "provider": "h2-local", "database": "npdev_dom_sales", "resetMode": "reset" },
  "runtime": { "springProfile": "dev,trial", "serverPort": 8421, "javaArgs": [], "gradleTask": "bootRun" },
  "trialDefaults": {
    "apiKey": "dev-key", "recommendedProfiles": "dev,trial", "runtimeUrl": "http://localhost:8421/",
    "databaseMode": "h2-local",
    "notes": ["DOM-2 sales pack consumer. Not release-gated; a hand-run fixture."]
  }
}
