{
  "$schema": "..\\..\\..\\..\\NPDevContract\\schemas\\config.schema.json",
  "configVersion": "1.0",
  "scenario": {
    "name": "maintenance-log",
    "description": "12works sample: Maintenance log for assets; a Flow-emitted custom event (AssetServiced) is consumed by an orchestration rule.",
    "outputRoot": "..\\Output"
  },
  "generator": {
    "failIfModelMissing": true,
    "failIfConfigMissing": true,
    "cleanOutputBeforeGenerate": true,
    "emitPluginAssets": true,
    "emitRuntimeAssets": true,
    "emitUiAssets": true
  },
  "bootstrap": {
    "root": "..\\..\\..\\NPDevRuntimeHost",
    "mergeStrategy": "clean-copy"
  },
  "artifact": {
    "root": "..\\Output\\ArtifactNP",
    "generatedFolderName": "npdev-generated",
    "libsFolderName": "libs",
    "metaFolderName": "npdev-meta"
  },
  "finalExec": {
    "root": "..\\Output\\App",
    "deleteBeforeMount": true
  },
  "database": {
    "provider": "h2-local",
    "database": "maintenance_log",
    "resetMode": "reset"
  },
  "runtime": {
    "springProfile": "dev,trial",
    "serverPort": 8105,
    "javaArgs": [],
    "gradleTask": "bootRun"
  },
  "trialDefaults": {
    "apiKey": "dev-key",
    "recommendedProfiles": "dev,trial",
    "runtimeUrl": "http://localhost:8105/",
    "databaseMode": "h2-local",
    "notes": [
      "12works sample, built to exercise: Maintenance log for assets; a Flow-emitted custom event (AssetServiced) is consumed by an orchestration rule."
    ]
  }
}
