{
  "$schema": "..\\..\\..\\..\\NPDevContract\\schemas\\config.schema.json",
  "configVersion": "1.0",
  "scenario": {
    "name": "p6-satellite-extension",
    "description": "PK-6 Step 1 probe: identity@1 composed with a throwaway 'clinical' extension pack declaring a satellite concept (satelliteOf: identity::User). Proves the base pack stays untouched and the satellite's own FK-linked table works end to end.",
    "outputRoot": "..\\Output"
  },
  "generator": {
    "failIfModelMissing": true,
    "failIfConfigMissing": true,
    "cleanOutputBeforeGenerate": true,
    "emitPluginAssets": false,
    "emitRuntimeAssets": true,
    "emitUiAssets": true
  },
  "bootstrap": {
    "root": "..\\..\\..\\..\\NPDevRuntimeHost",
    "mergeStrategy": "clean-copy"
  },
  "artifact": {
    "root": "..\\Output\\ArtifactNP",
    "generatedFolderName": "npdev-generated",
    "libsFolderName": "libs",
    "metaFolderName": "npdev-meta"
  },
  "finalExec": {
    "root": "..\\Output\\App",
    "deleteBeforeMount": true
  },
  "database": {
    "provider": "h2-local",
    "database": "p6_satellite_extension",
    "resetMode": "reset"
  },
  "runtime": {
    "springProfile": "dev,trial",
    "serverPort": 8172,
    "javaArgs": [],
    "gradleTask": "bootRun"
  },
  "trialDefaults": {
    "apiKey": "dev-key",
    "recommendedProfiles": "dev,trial",
    "runtimeUrl": "http://localhost:8172/",
    "databaseMode": "h2-local",
    "notes": [
      "Storage/pack probe for PK-6 Step 1 (satellite concepts). Do not add features."
    ]
  }
}
